Input,Output
The athlete won a gold medal at the Olympics,sports
The legislation was passed after a long debate in the Senate,politics
The discovery of the Higgs boson at CERN marked a milestone in particle physics,science
The swimmer broke the world record in the 100-meter freestyle,sports
The bill received bipartisan support and was signed into law by the president,politics
The recent findings on black holes have revolutionized our understanding of space-time,science
The spacecraft successfully docked with the International Space Station,space
The gymnast captured the audience's hearts and took home the bronze medal,sports
"After months of negotiations, the climate accord was finally agreed upon by the majority of nations.",politics
"Scientists successfully cloned a sheep, sparking ethical debates worldwide.",science
The scientist made a groundbreaking discovery in the field of quantum computing,science
The wildfire devastated thousands of acres of forest in California,environment
The company announced record profits for the third quarter in a row,business
The author's latest novel became an instant bestseller,literature
The chef prepared a delicious five-course meal for the wedding reception,food
The teacher inspired her students to pursue careers in science,education
The earthquake struck with a magnitude of 7.2, causing widespread damage,natural disasters
The artist's painting was sold at auction for a record price,art
The marathon runner crossed the finish line in under two hours,sports
The CEO announced a new sustainability initiative for the company,business
The musician's album received critical acclaim and won multiple awards,music
The rescue team saved a stranded hiker from a remote mountain peak,emergency services
The actor's performance in the play earned rave reviews from critics,entertainment
The museum unveiled a rare collection of ancient artifacts,history
The astronaut conducted experiments on the International Space Station,space
The police officer received a commendation for bravery in the line of duty,law enforcement
The chef's signature dish is a mouthwatering seafood paella,food
The archaeologist uncovered a hidden tomb filled with treasures,archaeology
The stock market experienced a sharp decline due to economic uncertainty,finance
The engineer designed an innovative solution to reduce carbon emissions,technology
The inventor's new gadget quickly became a must-have item,technology
The humanitarian organization provided aid to refugees in war-torn regions,humanitarianism
The environmentalist led a campaign to protect endangered species,environment
The technology company launched a new line of eco-friendly products,technology
The surfer caught a massive wave and rode it to perfection,sports
The lawyer won a landmark case that set a legal precedent,law
The mountaineer scaled the world's highest peak, Mount Everest,sports
The biologist made a breakthrough in genetic research,science
The meteorologist accurately predicted a severe thunderstorm,weather
The fashion designer showcased a stunning collection at Fashion Week,fashion
The film director's latest movie received a standing ovation at the premiere,entertainment
The philanthropist donated millions to a charitable foundation,philanthropy
The wildlife photographer captured stunning images of endangered animals,environment
The electric car revolutionized the automotive industry,automotive
The journalist exposed corruption at the highest levels of government,journalism
The dancer's performance left the audience in awe,entertainment
The software engineer developed a cutting-edge artificial intelligence system,technology
The detective solved a complex murder case with forensic evidence,law enforcement
The astronomer discovered a new exoplanet in a distant galaxy,science
The swimmer trained tirelessly for the upcoming Olympic Games,sports
The farmer's organic produce was in high demand at the local market,agriculture
The conductor led the orchestra in a flawless rendition of Beethoven's Symphony No. 9,music
The historian published a comprehensive biography of a famous leader,history
The psychologist conducted a groundbreaking study on human behavior,psychology
The geologist unearthed fossilized remains of prehistoric creatures,science
The astronaut conducted a spacewalk to repair the space station,space
The wildlife conservationist worked to save endangered species from extinction,environment
The mathematician solved a long-standing mathematical conjecture,mathematics
The CEO announced a merger that would create a global powerhouse,business
The poet's verses touched the hearts of readers around the world,literature
The surgeon performed a life-saving operation with precision,medicine
The entrepreneur launched a successful startup company,business
The historian's research shed new light on a historical event,history
The teacher received the Teacher of the Year award,education
The composer's symphony was performed by a world-renowned orchestra,music
The software developer created a popular mobile app,technology
The firefighter rescued a family from a burning building,emergency services
The chef's culinary skills earned a Michelin star,food
The cyclist completed a grueling cross-country race,sports
The artist's sculpture was displayed in a prestigious art gallery,art
The economist predicted a strong economic recovery,economics
The geneticist discovered a gene linked to a rare disease,science
The psychologist's book became a bestseller and influenced therapy practices,psychology
The diplomat negotiated a historic peace treaty,diplomacy
The astronaut conducted experiments in microgravity,space
The archaeologist uncovered ancient ruins in a remote jungle,archaeology
The biologist's research led to a breakthrough in cancer treatment,science
The mountaineer tackled challenging peaks around the world,sports
The philanthropist established a foundation to combat poverty,philanthropy
The journalist received a Pulitzer Prize for investigative reporting,journalism
The musician composed a symphony that moved audiences to tears,music
The software engineer developed a secure encryption algorithm,technology
The detective cracked a complex cold case that had baffled authorities for years,law enforcement
The environmentalist led a successful campaign to protect a pristine wilderness,environment
The astronaut orbited the Earth aboard the International Space Station,space
The author's book became a cultural phenomenon, inspiring a movie adaptation,literature
The inventor's invention transformed an entire industry,technology
The fashion designer's runway show was attended by celebrities and fashionistas,fashion
The entrepreneur's startup was acquired by a major tech corporation,business
The conductor led a world tour with a renowned orchestra,music
The historian's research uncovered lost historical documents,history
The psychologist's therapy techniques gained popularity worldwide,psychology
The biologist discovered a new species in the depths of the ocean,science
The artist's painting was displayed in a prestigious art museum,art
The CEO's leadership transformed the company's fortunes,business
The firefighter received a medal of valor for heroism,emergency services
The surgeon pioneered a groundbreaking surgical procedure,medicine
The economist's predictions influenced government policy,economics
The mountaineer overcame extreme challenges to summit a remote peak,sports
The astronaut conducted experiments on the surface of Mars during a historic mission,space
